{
  "schema": 1,
  "language": "mruby",
  "version": "4.0",
  "source": {
    "repo": "https://github.com/mruby/mruby.git",
    "ref": "4.0.0",
    "commit": "831da26b9021de0369d17b71b5667e2941a1a32d",
    "path": "mrbgems/mruby-compiler/core/parse.y",
    "sha256": "55a1234828ee815c89d7bc1e41eda7d007beebd055b6cc67e55d060c2ab6d4c1",
    "prepared_sha256": "55a1234828ee815c89d7bc1e41eda7d007beebd055b6cc67e55d060c2ab6d4c1",
    "committed_at": "2026-04-20T17:43:06+09:00",
    "license": {
      "name": "MIT",
      "url": "https://github.com/mruby/mruby/blob/4.0.0/LICENSE",
      "path": "LICENSE"
    }
  },
  "generator": {
    "frontend": "lrama",
    "tool_version": "0.8.0",
    "lrama_revision": "c8317b55850bc6cd9033ddfbf816377b73f6c7bc",
    "rdc": "1.0.0",
    "metadata_sha256": "89799ff9ca074ae700ca6ac1968d83814c483973026299c5006d3e16625af743"
  },
  "start": "program",
  "terminals": [
    {
      "name": "YYEOF",
      "display": "end of file",
      "kind": "internal",
      "alias": "\"end of file\""
    },
    {
      "name": "YYerror",
      "display": "error",
      "kind": "internal",
      "alias": "error"
    },
    {
      "name": "YYUNDEF",
      "display": "invalid token",
      "kind": "internal",
      "alias": "\"invalid token\""
    },
    {
      "name": "keyword_class",
      "display": "class",
      "kind": "keyword",
      "alias": "\"'class'\""
    },
    {
      "name": "keyword_module",
      "display": "module",
      "kind": "keyword",
      "alias": "\"'module'\""
    },
    {
      "name": "keyword_def",
      "display": "def",
      "kind": "keyword",
      "alias": "\"'def'\""
    },
    {
      "name": "keyword_begin",
      "display": "begin",
      "kind": "keyword",
      "alias": "\"'begin'\""
    },
    {
      "name": "keyword_if",
      "display": "if",
      "kind": "keyword",
      "alias": "\"'if'\""
    },
    {
      "name": "keyword_unless",
      "display": "unless",
      "kind": "keyword",
      "alias": "\"'unless'\""
    },
    {
      "name": "keyword_while",
      "display": "while",
      "kind": "keyword",
      "alias": "\"'while'\""
    },
    {
      "name": "keyword_until",
      "display": "until",
      "kind": "keyword",
      "alias": "\"'until'\""
    },
    {
      "name": "keyword_for",
      "display": "for",
      "kind": "keyword",
      "alias": "\"'for'\""
    },
    {
      "name": "keyword_undef",
      "display": "undef",
      "kind": "keyword",
      "alias": "\"'undef'\""
    },
    {
      "name": "keyword_rescue",
      "display": "rescue",
      "kind": "keyword",
      "alias": "\"'rescue'\""
    },
    {
      "name": "keyword_ensure",
      "display": "ensure",
      "kind": "keyword",
      "alias": "\"'ensure'\""
    },
    {
      "name": "keyword_end",
      "display": "end",
      "kind": "keyword",
      "alias": "\"'end'\""
    },
    {
      "name": "keyword_then",
      "display": "then",
      "kind": "keyword",
      "alias": "\"'then'\""
    },
    {
      "name": "keyword_elsif",
      "display": "elsif",
      "kind": "keyword",
      "alias": "\"'elsif'\""
    },
    {
      "name": "keyword_else",
      "display": "else",
      "kind": "keyword",
      "alias": "\"'else'\""
    },
    {
      "name": "keyword_case",
      "display": "case",
      "kind": "keyword",
      "alias": "\"'case'\""
    },
    {
      "name": "keyword_when",
      "display": "when",
      "kind": "keyword",
      "alias": "\"'when'\""
    },
    {
      "name": "keyword_break",
      "display": "break",
      "kind": "keyword",
      "alias": "\"'break'\""
    },
    {
      "name": "keyword_next",
      "display": "next",
      "kind": "keyword",
      "alias": "\"'next'\""
    },
    {
      "name": "keyword_redo",
      "display": "redo",
      "kind": "keyword",
      "alias": "\"'redo'\""
    },
    {
      "name": "keyword_retry",
      "display": "retry",
      "kind": "keyword",
      "alias": "\"'retry'\""
    },
    {
      "name": "keyword_in",
      "display": "in",
      "kind": "keyword",
      "alias": "\"'in'\""
    },
    {
      "name": "keyword_do",
      "display": "do",
      "kind": "keyword",
      "alias": "\"'do'\""
    },
    {
      "name": "keyword_do_cond",
      "display": "do",
      "kind": "keyword",
      "alias": "\"'do' for condition\""
    },
    {
      "name": "keyword_do_block",
      "display": "do",
      "kind": "keyword",
      "alias": "\"'do' for block\""
    },
    {
      "name": "keyword_do_LAMBDA",
      "display": "do",
      "kind": "keyword",
      "alias": "\"'do' for lambda\""
    },
    {
      "name": "keyword_return",
      "display": "return",
      "kind": "keyword",
      "alias": "\"'return'\""
    },
    {
      "name": "keyword_yield",
      "display": "yield",
      "kind": "keyword",
      "alias": "\"'yield'\""
    },
    {
      "name": "keyword_super",
      "display": "super",
      "kind": "keyword",
      "alias": "\"'super'\""
    },
    {
      "name": "keyword_self",
      "display": "self",
      "kind": "keyword",
      "alias": "\"'self'\""
    },
    {
      "name": "keyword_nil",
      "display": "nil",
      "kind": "keyword",
      "alias": "\"'nil'\""
    },
    {
      "name": "keyword_true",
      "display": "true",
      "kind": "keyword",
      "alias": "\"'true'\""
    },
    {
      "name": "keyword_false",
      "display": "false",
      "kind": "keyword",
      "alias": "\"'false'\""
    },
    {
      "name": "keyword_and",
      "display": "and",
      "kind": "keyword",
      "alias": "\"'and'\""
    },
    {
      "name": "keyword_or",
      "display": "or",
      "kind": "keyword",
      "alias": "\"'or'\""
    },
    {
      "name": "keyword_not",
      "display": "not",
      "kind": "keyword",
      "alias": "\"'not'\""
    },
    {
      "name": "modifier_if",
      "display": "'if' modifier",
      "kind": "punct",
      "alias": "\"'if' modifier\""
    },
    {
      "name": "modifier_unless",
      "display": "'unless' modifier",
      "kind": "punct",
      "alias": "\"'unless' modifier\""
    },
    {
      "name": "modifier_while",
      "display": "'while' modifier",
      "kind": "punct",
      "alias": "\"'while' modifier\""
    },
    {
      "name": "modifier_until",
      "display": "'until' modifier",
      "kind": "punct",
      "alias": "\"'until' modifier\""
    },
    {
      "name": "modifier_rescue",
      "display": "'rescue' modifier",
      "kind": "punct",
      "alias": "\"'rescue' modifier\""
    },
    {
      "name": "keyword_alias",
      "display": "alias",
      "kind": "keyword",
      "alias": "\"'alias'\""
    },
    {
      "name": "keyword_BEGIN",
      "display": "BEGIN",
      "kind": "keyword",
      "alias": "\"'BEGIN'\""
    },
    {
      "name": "keyword_END",
      "display": "END",
      "kind": "keyword",
      "alias": "\"'END'\""
    },
    {
      "name": "keyword__LINE__",
      "display": "__LINE__",
      "kind": "punct",
      "alias": "\"'__LINE__'\""
    },
    {
      "name": "keyword__FILE__",
      "display": "__FILE__",
      "kind": "punct",
      "alias": "\"'__FILE__'\""
    },
    {
      "name": "keyword__ENCODING__",
      "display": "__ENCODING__",
      "kind": "punct",
      "alias": "\"'__ENCODING__'\""
    },
    {
      "name": "tIDENTIFIER",
      "display": "identifier",
      "kind": "class",
      "alias": "\"local variable or method\""
    },
    {
      "name": "tFID",
      "display": "method name",
      "kind": "class",
      "alias": "\"method\""
    },
    {
      "name": "tGVAR",
      "display": "global variable",
      "kind": "class",
      "alias": "\"global variable\""
    },
    {
      "name": "tIVAR",
      "display": "instance variable",
      "kind": "class",
      "alias": "\"instance variable\""
    },
    {
      "name": "tCONSTANT",
      "display": "constant",
      "kind": "class",
      "alias": "\"constant\""
    },
    {
      "name": "tCVAR",
      "display": "class variable",
      "kind": "class",
      "alias": "\"class variable\""
    },
    {
      "name": "tLABEL_TAG",
      "display": "label",
      "kind": "class",
      "alias": "\"label\""
    },
    {
      "name": "tINTEGER",
      "display": "integer",
      "kind": "class",
      "alias": "\"integer literal\""
    },
    {
      "name": "tFLOAT",
      "display": "float",
      "kind": "class",
      "alias": "\"float literal\""
    },
    {
      "name": "tCHAR",
      "display": "character",
      "kind": "class",
      "alias": "\"character literal\""
    },
    {
      "name": "tXSTRING",
      "display": "tXSTRING",
      "kind": "class"
    },
    {
      "name": "tREGEXP",
      "display": "tREGEXP",
      "kind": "class"
    },
    {
      "name": "tSTRING",
      "display": "tSTRING",
      "kind": "class"
    },
    {
      "name": "tSTRING_PART",
      "display": "tSTRING_PART",
      "kind": "class"
    },
    {
      "name": "tSTRING_MID",
      "display": "tSTRING_MID",
      "kind": "class"
    },
    {
      "name": "tNTH_REF",
      "display": "numbered reference",
      "kind": "class"
    },
    {
      "name": "tBACK_REF",
      "display": "back reference",
      "kind": "class"
    },
    {
      "name": "tREGEXP_END",
      "display": "tREGEXP_END",
      "kind": "class"
    },
    {
      "name": "tNUMPARAM",
      "display": "numbered parameter",
      "kind": "punct",
      "alias": "\"numbered parameter\""
    },
    {
      "name": "tUPLUS",
      "display": "unary plus",
      "kind": "punct",
      "alias": "\"unary plus\""
    },
    {
      "name": "tUMINUS",
      "display": "unary minus",
      "kind": "punct",
      "alias": "\"unary minus\""
    },
    {
      "name": "tCMP",
      "display": "<=>",
      "kind": "punct",
      "alias": "\"<=>\""
    },
    {
      "name": "tEQ",
      "display": "==",
      "kind": "punct",
      "alias": "\"==\""
    },
    {
      "name": "tEQQ",
      "display": "===",
      "kind": "punct",